{
  "schema_version": "drift_budget_signal_v1",
  "producer": {
    "repo": "HanzoRazer/code-analysis-tool",
    "workflow": "contract-parity-main-observer",
    "run_id": "123456789",
    "run_attempt": 1,
    "run_url": "https://github.com/HanzoRazer/code-analysis-tool/actions/runs/123456789",
    "sha": "abcdef1234567890"
  },
  "episode": {
    "group_key": "contracts",
    "first_detected_iso": "2026-02-14T09:20:00Z",
    "last_resolved_iso": "2026-02-16T00:10:05Z",
    "status": "unresolved",
    "unresolved_seconds": 123456,
    "unresolved_human": "1d 10h 17m",
    "budget_hours": 48,
    "breached": true,
    "breach_seconds": 50256
  },
  "provenance": {
    "ci_mode": true,
    "rotation": {
      "config_sha12": "a1b2c3d4e5f6",
      "schema_sha12": "0f1e2d3c4b5a",
      "schema_version": "oncall_rotation_schema_v1"
    }
  }
}
